{
  "report_version": "1.0",
  "matrix_version": "1.5-proposed-1",
  "manifest_ref": "manifest-managed-m15-example",
  "active_context": [
    {"source_ref": "context-root-agents", "evidence_refs": ["evidence-context-loaded"]}
  ],
  "active_controls": [
    {"source_ref": "control-sandbox", "evidence_refs": ["evidence-sandbox-probe"]}
  ],
  "excluded_context": [],
  "applicability_results": [
    {"source_ref": "context-root-agents", "decision": "add_for_task", "evidence_refs": ["evidence-applicability-gate"]},
    {"source_ref": "control-sandbox", "decision": "maintain", "evidence_refs": ["evidence-applicability-gate"]}
  ],
  "lint_findings": [],
  "claim_results": [
    {"claim_id": "CGM-001", "category": "required_context_loaded", "verdict": "supported", "evidence_refs": ["evidence-context-loaded"], "conflict_refs": [], "residual_risks": ["관찰하지 않은 실행 경로의 로드 여부는 알 수 없다"], "permitted_statement": "필요한 Context Source가 관찰된 실행 범위에서 로드됐다"},
    {"claim_id": "CGM-002", "category": "relevant_skill_invoked", "verdict": "not_evaluated", "evidence_refs": [], "conflict_refs": [], "residual_risks": ["호출 자체는 지침 준수나 결과 개선을 증명하지 않는다"], "permitted_statement": null},
    {"claim_id": "CGM-003", "category": "conflicting_instruction_detected", "verdict": "not_evaluated", "evidence_refs": [], "conflict_refs": [], "residual_risks": ["동적 경로와 의미적 바꿔쓰기는 탐지하지 못할 수 있다"], "permitted_statement": null},
    {"claim_id": "CGM-004", "category": "stale_context_identified", "verdict": "not_evaluated", "evidence_refs": [], "conflict_refs": [], "residual_risks": ["파일 존재만으로 설명의 의미적 최신성을 증명할 수 없다"], "permitted_statement": null},
    {"claim_id": "CGM-005", "category": "context_profile_improved", "verdict": "not_evaluated", "evidence_refs": [], "conflict_refs": [], "residual_risks": ["한 Fixture와 한 모델 설정의 결과를 다른 작업이나 모델에 일반화할 수 없다"], "permitted_statement": null},
    {"claim_id": "CGM-006", "category": "unobserved_context_path_exists", "verdict": "not_evaluated", "evidence_refs": [], "conflict_refs": [], "residual_risks": ["미관찰은 부재나 실패를 뜻하지 않는다"], "permitted_statement": null}
  ]
}
